{
  "$schema": "../../.mlgs/change-plan.schema.json",
  "schemaVersion": "1.0",
  "taskId": "replace-me",
  "projectKind": "new-project",
  "intensity": "lightweight",
  "targetModuleId": "",
  "architectureDecision": "create-new-foundation",
  "decisionReason": "Choose the smallest architecture that satisfies the task and current project maturity.",
  "legacyTradeoff": { "consistencyBenefit": "", "newRequirementBenefit": "", "risk": "", "approvalRequired": false, "approved": false },
  "responsibilities": [{ "name": "replace-me", "scriptRole": "pure-csharp", "path": "Assets/Game/ReplaceMe.cs", "moduleId": "", "owns": ["Replace with one explicit responsibility."] }],
  "reuseExisting": [],
  "newAbstractions": [],
  "plannedFiles": { "modify": [], "create": [], "delete": [], "evidence": [] },
  "dependencyChanges": [],
  "lifecycle": "Describe initialization, activation, cleanup, and scene unload behavior.",
  "dataOwnership": "Describe authoritative runtime, configuration, and save state ownership.",
  "errorHandling": "Describe validation, failure, fallback, and logging behavior.",
  "testPlan": ["Replace with focused EditMode, PlayMode, compile, or integration evidence."],
  "architectVerdict": "pending",
  "status": "draft",
  "blockers": [],
  "updated": ""
}
